{
  "schema_version": "1.0.0",
  "id": "correction.earnings-restored.2026q2.c1",
  "correction_type": "processing",
  "corrects": {
    "kind": "predicate-observation",
    "id": "observation.earnings-restored.2026q2",
    "checksum": "sha256:f5e1bbb97b8e4d7f5aa93e646b647629eb1607b91e986ff9b317480e705ad638"
  },
  "replacement": {
    "kind": "predicate-observation",
    "id": "observation.earnings-restored.2026q2.c1",
    "checksum": "sha256:13e9ff29378a280302a06cd0f53f45acd36c4eb290a7a825ed3299f89938ded4"
  },
  "invalidates": [{
    "kind": "evaluation-run",
    "id": "evaluation.au-clerical-access-margin.20260908t0000z",
      "checksum": "sha256:e2fb9050b5b24343ecaa1fee6c21c40bbbb3491d1e47fd1e699b15409daf1abc"
  }],
  "reason": "A synthetic linkage-job defect hid both replacement-earnings quarters. The original observation and every run that consumed it remain preserved but superseded or invalidated.",
  "recorded_at": "2026-09-08T00:10:00Z",
  "provenance": {
    "producer": { "organisation": "Seldon Observatory pilot", "role": "correction steward" },
    "method": "two-person correction review 1.0",
    "reviewed_by": { "organisation": "Seldon Observatory pilot", "role": "independent fixture reviewer" }
  }
}
